{
  "address": "0xc284071b000eb4fa7d7d77c85a391bba824b4d2d",
  "type": "ERC721",
  "name": "Giovani Cordioli Collection",
  "tokenCount": "5",
  "uri": "https://arweave.net/pRx0IQu_soMDjWoQRABeI5C0S-fnQTA1O6G6JCG1DW8",
  "metadata": {
    "name": "Surfer",
    "created_by": "Giovani Cordioli",
    "description": "I took this photo of the surfer entering the sea after doing a trail early in the morning from the top of a hill on an isolated beach on Florianópolis, in the south of Brazil. The beautiful textures of the sand and water helped a lot in the result of the final minimalist composition.\n\nTitle: Surfer  \nArtist: Giovani Cordioli  \nSeries: Minimalist Nature  \nEdition: 1/1  \nLocation: Florianópolis / Brazil  \nDimensions: 4016 × 6016px  \nYear: 2022  \n \nLicense: Extended Editorial - Can be used to display privately, or in commercial and non-commercial settings, or in groups with an unlimited number of participants. The license includes unlimited use and display in virtual or physical galleries, documentaries, and essays by the NFT holder. Provides no rights to create commercial merchandise, commercial distribution, or derivative works. Copyright remains with the Creator.",
    "attributes": [
      {
        "trait_type": "Artist",
        "value": "Giovani Cordioli"
      },
      {
        "trait_type": "Series",
        "value": "Minimalist Nature"
      },
      {
        "trait_type": "Edition",
        "value": "1/1"
      },
      {
        "trait_type": "Genre",
        "value": "Photography"
      },
      {
        "trait_type": "Location",
        "value": "Florianópolis / Brazil"
      },
      {
        "trait_type": "License ",
        "value": "Extended Editorial"
      },
      {
        "trait_type": "Dimensions",
        "value": "4016 × 6016px"
      },
      {
        "trait_type": "Year",
        "value": "2022"
      }
    ],
    "image_details": {
      "bytes": 23311790,
      "format": "JPEG",
      "sha256": "e37fd99da16a9145c6ffd8b23b769de8609abc7a448f6b9414ae2f5c2e2595ac",
      "width": 4016,
      "height": 6016
    },
    "image": "https://arweave.net/fJTy4mPqO3QVzAZDoP7OwMj59vqCMnM3QRvzYzBgO38",
    "image_url": "https://arweave.net/fJTy4mPqO3QVzAZDoP7OwMj59vqCMnM3QRvzYzBgO38"
  }
}